{
  "n": "TC Insight Spec",
  "v": "2.0.0",
  "s": {
    "P": {
      "n": "Profile",
      "p": [
        {
          "10": {
            "n": {
              "SYS": "Surname"
            },
            "label": "P-10",
            "t": [
              {
                "t": "T"
              }
            ]
          }
        },
        {
          "20": {
            "n": {
              "SYS": "Name"
            },
            "label": "P-20",
            "t": [
              {
                "t": "T"
              }
            ]
          }
        },
        {
          "30": {
            "n": {
              "SYS": "Enumerator Code"
            },
            "label": "P-30",
            "t": [
              {
                "t": "N"
              }
            ]
          }
        },
        {
          "40": {
            "n": {
              "SYS": "Supervisor Code"
            },
            "label": "P-40",
            "t": [
              {
                "t": "N"
              }
            ]
          }
        },
        {
          "50": {
            "n": {
              "SYS": "Date"
            },
            "label": "P-50",
            "t": [
              {
                "t": "N"
              }
            ]
          }
        },
        {
          "60": {
            "n": {
              "SYS": "Telephone number"
            },
            "label": "P-60",
            "t": [
              {
                "t": "N"
              }
            ]
          }
        },
        {
          "70": {
            "n": {
              "SYS": "Time stamp START Interview"
            },
            "label": "P-70",
            "t": [
              {
                "t": "N"
              }
            ]
          }
        }
      ]
    },
    "A": {
      "n": "Area",
      "p": [
        {
          "10": {
            "n": {
              "SYS": "What region are you located?"
            },
            "label": "A-10",
            "t": [
              {
                "t": "O",
                "o": "LST-AREA-LV1"
              }
            ],
            "o": [
              "e",
              "b",
              "bp"
            ]
          }
        },
        {
          "20": {
            "n": {
              "SYS": "What prefecture are you located?"
            },
            "label": "A-20",
            "t": [
              {
                "t": "O",
                "o": "LST-AREA-LV2"
              }
            ],
            "o": [
              "e",
              "b",
              "bp"
            ]
          }
        },
        {
          "30": {
            "n": {
              "SYS": "What sub-prefecture/commune are you located?"
            },
            "label": "A-30",
            "t": [
              {
                "t": "O",
                "o": "LST-AREA-LV3"
              }
            ],
            "o": [
              "e",
              "b",
              "bp"
            ]
          }
        },
        {
          "40": {
            "n": {
              "SYS": "What quartier are you located?"
            },
            "label": "A-40",
            "t": [
              {
                "t": "O"
              }
            ],
            "o": [
              "e",
              "b",
              "bp"
            ]
          }
        },
        {
          "70": {
            "n": {
              "SYS": "What is the Zip Code (Code postal)?"
            },
            "label": "A-70",
            "t": [
              {
                "t": "O"
              }
            ],
            "o": [
              "e",
              "b",
              "bp"
            ]
          }
        }
      ]
    },
    "O": {
      "n": "Outlet details",
      "p": [
        {
          "10": {
            "n": {
              "SYS": "GPS location of outlet"
            },
            "label": "O-10",
            "t": [
              {
                "t": "T"
              }
            ],
            "o": [
              "e",
              "b",
              "bp"
            ]
          }
        },
        {
          "40": {
            "n": {
              "SYS": "What is the address/landmark point that identifies the outlet? (e.g. NEAR THIS... NEXT TO... BEHIND THIS...)"
            },
            "label": "O-40",
            "t": [
              {
                "t": "T"
              }
            ],
            "o": [
              "e",
              "b",
              "bp"
            ]
          }
        },
        {
          "41": {
            "n": {
              "SYS": "What is the Street Name?"
            },
            "label": "O-41",
            "t": [
              {
                "t": "T"
              }
            ],
            "o": [
              "e",
              "b",
              "bp"
            ]
          }
        },
        {
          "60": {
            "n": {
              "SYS": "What is the name of the outlet?"
            },
            "label": "O-60",
            "t": [
              {
                "t": "T"
              }
            ],
            "o": [
              "e",
              "b",
              "bp"
            ]
          }
        },
        {
          "61": {
            "n": {
              "SYS": "What other name is this outlet known by?"
            },
            "label": "O-61",
            "t": [
              {
                "t": "T"
              }
            ],
            "o": [
              "e",
              "b",
              "bp"
            ]
          }
        }
      ]
    },
    "I": {
      "n": "Interview Start",
      "p": [
        {
          "10": {
            "n": {
              "SYS": "Find the most senior person available (Manager or Owner)"
            },
            "label": "I-10",
            "t": [
              {
                "t": "-"
              }
            ],
            "o": [
              "e",
              "b"
            ]
          }
        },
        {
          "20": {
            "n": {
              "SYS": "Who are you speaking to?"
            },
            "label": "I-20",
            "t": [
              {
                "t": "O",
                "o": "LST-INTERVIEWEE-ROLE"
              }
            ],
            "o": [
              "e",
              "b",
              "bp"
            ]
          }
        },
        {
          "30": {
            "n": {
              "SYS": "INTRODUCTION: My name is .â€¦ Our company is operating a Trade Census. The objective is to better understand the tobacco market to eventually improve service to you as point of sale."
            },
            "label": "I-30",
            "t": [
              {
                "t": "-"
              }
            ],
            "o": [
              "e",
              "b"
            ]
          }
        },
        {
          "31": {
            "n": {
              "SYS": "A colleague of mine has recently visited you to conduct a Trade Census, and to insure we have quality information I am checking that we have correctly captured the information about your point of sale. I will be asking you a select number of questions for quality purposes."
            },
            "label": "I-31",
            "t": [
              {
                "t": "-"
              }
            ],
            "o": [
              "b"
            ]
          }
        },
        {
          "40": {
            "n": {
              "SYS": "Would you have a few minutes available to answer some questions about your business? This should not take long."
            },
            "label": "I-40",
            "t": [
              {
                "t": "O",
                "o": "LST-CONTINUE"
              }
            ],
            "o": [
              "e",
              "b"
            ]
          }
        },
        {
          "130": {
            "n": {
              "SYS": "Are most (over 50%) of your sales to:"
            },
            "label": "I-130",
            "t": [
              {
                "t": "O",
                "o": "LST-SEGMENT"
              }
            ],
            "o": [
              "e",
              "b"
            ]
          }
        },
        {
          "134": {
            "n": {
              "SYS": "Do you sell Cigarettes ?"
            },
            "label": "I-134",
            "t": [
              {
                "t": "O",
                "o": "LST-YES-NO"
              }
            ],
            "o": [
              "e",
              "b"
            ]
          }
        },
        {
          "131": {
            "n": {
              "SYS": "Select the retailer channel"
            },
            "label": "I-131",
            "t": [
              {
                "t": "O",
                "o": "LST-SEGMENT-RETAIL-CHANNEL"
              }
            ],
            "o": [
              "e",
              "b"
            ],
            "v": [
              {
                "r": "I-130",
                "o": "=",
                "t": "v",
                "v": "SEG1"
              }
            ]
          }
        },
        {
          "133": {
            "n": {
              "SYS": "Select the wholesaler channel"
            },
            "label": "I-133",
            "t": [
              {
                "t": "O",
                "o": "LST-SEGMENT-WHOLESALER-CHANNEL"
              }
            ],
            "o": [
              "e",
              "b"
            ],
            "v": [
              {
                "r": "I-130",
                "o": "=",
                "t": "v",
                "v": "SEG1"
              }
            ]
          }
        },
        {
          "1351": {
            "n": {
              "SYS": "Are you also distributing to other retailer ?"
            },
            "label": "I-1351",
            "t": [
              {
                "t": "O",